{
{
}
}
$~~@#!#@~~$
/dev/bus/2 -d sat+megaraid,0 # /dev/bus/2 [megaraid_disk_00] [SAT], ATA device
$~~@#!#@~~$
smartctl 6.5 2016-01-24 r4214 [x86_64-linux-4.4.0-79-generic] (local build)
Copyright (C) 2002-16, Bruce Allen, Christian Franke, www.smartmontools.org

=== START OF INFORMATION SECTION ===
Model Family:     Intel 730 and DC S35x0/3610/3700 Series SSDs
Device Model:     INTEL SSDSC2BP480G4
Serial Number:    BTJR51660055480BGN
LU WWN Device Id: 5 5cd2e4 04b7ee0e9
Firmware Version: L2010420
User Capacity:    480,103,981,056 bytes [480 GB]
Sector Size:      512 bytes logical/physical
Rotation Rate:    Solid State Device
Form Factor:      2.5 inches
Device is:        In smartctl database [for details use: -P show]
ATA Version is:   ATA8-ACS T13/1699-D revision 4
SATA Version is:  SATA 2.6, 6.0 Gb/s (current: 1.5 Gb/s)
Local Time is:    Tue Jan  9 23:39:06 2018 PST
SMART support is: Available - device has SMART capability.
SMART support is: Enabled
AAM feature is:   Unavailable
APM feature is:   Unavailable
Rd look-ahead is: Enabled
Write cache is:   Enabled
ATA Security is:  Disabled, NOT FROZEN [SEC1]
Write SCT (Get) Feature Control Command failed: ATA return descriptor not supported by controller firmware
Wt Cache Reorder: Unknown (SCT Feature Control command failed)

=== START OF READ SMART DATA SECTION ===
SMART Status not supported: ATA return descriptor not supported by controller firmware
SMART overall-health self-assessment test result: PASSED
Warning: This result is based on an Attribute check.

General SMART Values:
Offline data collection status:  (0x00)	Offline data collection activity
					was never started.
					Auto Offline Data Collection: Disabled.
Self-test execution status:      (   0)	The previous self-test routine completed
					without error or no self-test has ever 
					been run.
Total time to complete Offline 
data collection: 		(    0) seconds.
Offline data collection
capabilities: 			 (0x79) SMART execute Offline immediate.
					No Auto Offline data collection support.
					Suspend Offline collection upon new
					command.
					Offline surface scan supported.
					Self-test supported.
					Conveyance Self-test supported.
					Selective Self-test supported.
SMART capabilities:            (0x0003)	Saves SMART data before entering
					power-saving mode.
					Supports SMART auto save timer.
Error logging capability:        (0x01)	Error logging supported.
					General Purpose Logging supported.
Short self-test routine 
recommended polling time: 	 (   1) minutes.
Extended self-test routine
recommended polling time: 	 (   2) minutes.
Conveyance self-test routine
recommended polling time: 	 (   2) minutes.
SCT capabilities: 	       (0x003d)	SCT Status supported.
					SCT Error Recovery Control supported.
					SCT Feature Control supported.
					SCT Data Table supported.

SMART Attributes Data Structure revision number: 1
Vendor Specific SMART Attributes with Thresholds:
ID# ATTRIBUTE_NAME          FLAG     VALUE WORST THRESH TYPE      UPDATED  WHEN_FAILED RAW_VALUE
  5 Reallocated_Sector_Ct   0x0032   096   096   000    Old_age   Always       -       0
  9 Power_On_Hours          0x0032   100   100   000    Old_age   Always       -       11885
 12 Power_Cycle_Count       0x0032   100   100   000    Old_age   Always       -       35
170 Available_Reservd_Space 0x0033   100   100   010    Pre-fail  Always       -       0
171 Program_Fail_Count      0x0032   100   100   000    Old_age   Always       -       0
172 Erase_Fail_Count        0x0032   100   100   000    Old_age   Always       -       0
174 Unsafe_Shutdown_Count   0x0032   100   100   000    Old_age   Always       -       33
175 Power_Loss_Cap_Test     0x0033   100   100   010    Pre-fail  Always       -       638 (64 7982)
183 SATA_Downshift_Count    0x0032   100   100   000    Old_age   Always       -       0
184 End-to-End_Error        0x0033   100   100   090    Pre-fail  Always       -       0
187 Reported_Uncorrect      0x0032   100   100   000    Old_age   Always       -       0
190 Temperature_Case        0x0022   073   070   000    Old_age   Always       -       27 (Min/Max 25/30)
192 Unsafe_Shutdown_Count   0x0032   100   100   000    Old_age   Always       -       33
194 Temperature_Internal    0x0022   100   100   000    Old_age   Always       -       27
197 Current_Pending_Sector  0x0032   100   100   000    Old_age   Always       -       0
199 CRC_Error_Count         0x003e   100   100   000    Old_age   Always       -       0
225 Host_Writes_32MiB       0x0032   100   100   000    Old_age   Always       -       1916168
226 Workld_Media_Wear_Indic 0x0032   100   100   000    Old_age   Always       -       512
227 Workld_Host_Reads_Perc  0x0032   100   100   000    Old_age   Always       -       7
228 Workload_Minutes        0x0032   100   100   000    Old_age   Always       -       330537
232 Available_Reservd_Space 0x0033   100   100   010    Pre-fail  Always       -       0
233 Media_Wearout_Indicator 0x0032   090   090   000    Old_age   Always       -       0
234 Thermal_Throttle        0x0032   100   100   000    Old_age   Always       -       0/0
241 Host_Writes_32MiB       0x0032   100   100   000    Old_age   Always       -       1916168
242 Host_Reads_32MiB        0x0032   100   100   000    Old_age   Always       -       182269

General Purpose Log Directory Version 1
SMART           Log Directory Version 1 [multi-sector log support]
Address    Access  R/W   Size  Description
0x00       GPL,SL  R/O      1  Log Directory
0x01       GPL,SL  R/O      1  Summary SMART error log
0x02       GPL,SL  R/O      8  Comprehensive SMART error log
0x03       GPL,SL  R/O     20  Ext. Comprehensive SMART error log
0x04       GPL,SL  R/O      8  Device Statistics log
0x06       GPL,SL  R/O      1  SMART self-test log
0x07       GPL,SL  R/O      2  Extended self-test log
0x09       GPL,SL  R/W      1  Selective self-test log
0x10       GPL,SL  R/O      1  SATA NCQ Queued Error log
0x11       GPL,SL  R/O      1  SATA Phy Event Counters log
0x80-0x9f  GPL,SL  R/W     16  Host vendor specific log
0xb0       GPL,SL  VS       1  Device vendor specific log
0xb1       GPL,SL  VS      33  Device vendor specific log
0xd1       GPL     VS   13056  Device vendor specific log
0xdf       GPL     VS    1152  Device vendor specific log
0xdf       SL      VS     128  Device vendor specific log
0xe0       GPL,SL  R/W      1  SCT Command/Status
0xe1       GPL,SL  R/W      1  SCT Data Transfer

SMART Extended Comprehensive Error Log Version: 1 (20 sectors)
Device Error Count: 55
	CR     = Command Register
	FEATR  = Features Register
	COUNT  = Count (was: Sector Count) Register
	LBA_48 = Upper bytes of LBA High/Mid/Low Registers ]  ATA-8
	LH     = LBA High (was: Cylinder High) Register    ]   LBA
	LM     = LBA Mid (was: Cylinder Low) Register      ] Register
	LL     = LBA Low (was: Sector Number) Register     ]
	DV     = Device (was: Device/Head) Register
	DC     = Device Control Register
	ER     = Error register
	ST     = Status register
Powered_Up_Time is measured from power on, and printed as
DDd+hh:mm:SS.sss where DD=days, hh=hours, mm=minutes,
SS=sec, and sss=millisec. It "wraps" after 49.710 days.

Warning! SMART Extended Comprehensive Error Log Structure error: invalid SMART checksum.
Error 55 [54] occurred at disk power-on lifetime: 11885 hours (495 days + 5 hours)
  When the command that caused the error occurred, the device was active or idle.

  After command completion occurred, registers were:
  ER -- ST COUNT  LBA_48  LH LM LL DV DC
  -- -- -- == -- == == == -- -- -- -- --
  c0 -- 01 00 01 00 00 00 c2 4f e0 00 00  Error: 

  Commands leading to the command that caused the error were:
  CR FEATR COUNT  LBA_48  LH LM LL DV DC  Powered_Up_Time  Command/Feature_Name
  -- == -- == -- == == == -- -- -- -- --  ---------------  --------------------
  b0 00 d6 00 01 00 00 00 c2 4f e0 00 00 30d+16:51:19.400  SMART WRITE LOG
  ef 00 66 00 00 00 00 00 00 00 00 00 00 30d+16:51:19.154  SET FEATURES [Disable revert defaults]
  ef 00 02 00 00 00 00 00 00 00 00 00 00 30d+16:51:19.154  SET FEATURES [Enable write cache]
  ef 00 aa 00 00 00 00 00 00 00 00 00 00 30d+16:51:19.154  SET FEATURES [Enable read look-ahead]
  ef 00 03 00 46 00 00 00 00 00 00 00 00 30d+16:51:19.154  SET FEATURES [Set transfer mode]

Error 54 [53] occurred at disk power-on lifetime: 11885 hours (495 days + 5 hours)
  When the command that caused the error occurred, the device was active or idle.

  After command completion occurred, registers were:
  ER -- ST COUNT  LBA_48  LH LM LL DV DC
  -- -- -- == -- == == == -- -- -- -- --
  c0 -- 01 00 01 00 00 00 c2 4f e0 00 00  Error: 

  Commands leading to the command that caused the error were:
  CR FEATR COUNT  LBA_48  LH LM LL DV DC  Powered_Up_Time  Command/Feature_Name
  -- == -- == -- == == == -- -- -- -- --  ---------------  --------------------
  b0 00 d6 00 01 00 00 00 c2 4f e0 00 00 30d+16:51:18.153  SMART WRITE LOG
  ef 00 66 00 00 00 00 00 00 00 00 00 00 30d+16:51:17.907  SET FEATURES [Disable revert defaults]
  ef 00 02 00 00 00 00 00 00 00 00 00 00 30d+16:51:17.907  SET FEATURES [Enable write cache]
  ef 00 aa 00 00 00 00 00 00 00 00 00 00 30d+16:51:17.907  SET FEATURES [Enable read look-ahead]
  ef 00 03 00 46 00 00 00 00 00 00 00 00 30d+16:51:17.907  SET FEATURES [Set transfer mode]

Error 53 [52] occurred at disk power-on lifetime: 11885 hours (495 days + 5 hours)
  When the command that caused the error occurred, the device was active or idle.

  After command completion occurred, registers were:
  ER -- ST COUNT  LBA_48  LH LM LL DV DC
  -- -- -- == -- == == == -- -- -- -- --
  c0 -- 01 00 01 00 00 00 c2 4f e0 00 00  Error: 

  Commands leading to the command that caused the error were:
  CR FEATR COUNT  LBA_48  LH LM LL DV DC  Powered_Up_Time  Command/Feature_Name
  -- == -- == -- == == == -- -- -- -- --  ---------------  --------------------
  b0 00 d6 00 01 00 00 00 c2 4f e0 00 00 30d+16:51:16.906  SMART WRITE LOG
  ef 00 66 00 00 00 00 00 00 00 00 00 00 30d+16:51:16.660  SET FEATURES [Disable revert defaults]
  ef 00 02 00 00 00 00 00 00 00 00 00 00 30d+16:51:16.659  SET FEATURES [Enable write cache]
  ef 00 aa 00 00 00 00 00 00 00 00 00 00 30d+16:51:16.659  SET FEATURES [Enable read look-ahead]
  ef 00 03 00 46 00 00 00 00 00 00 00 00 30d+16:51:16.659  SET FEATURES [Set transfer mode]

Warning! SMART Extended Comprehensive Error Log Structure error: invalid SMART checksum.
Error 52 [51] occurred at disk power-on lifetime: 11885 hours (495 days + 5 hours)
  When the command that caused the error occurred, the device was active or idle.

  After command completion occurred, registers were:
  ER -- ST COUNT  LBA_48  LH LM LL DV DC
  -- -- -- == -- == == == -- -- -- -- --
  c0 -- 01 00 01 00 00 00 c2 4f e0 00 00  Error: 

  Commands leading to the command that caused the error were:
  CR FEATR COUNT  LBA_48  LH LM LL DV DC  Powered_Up_Time  Command/Feature_Name
  -- == -- == -- == == == -- -- -- -- --  ---------------  --------------------
  b0 00 d6 00 01 00 00 00 c2 4f e0 00 00 30d+16:51:15.659  SMART WRITE LOG
  ef 00 66 00 00 00 00 00 00 00 00 00 00 30d+16:51:15.413  SET FEATURES [Disable revert defaults]
  ef 00 02 00 00 00 00 00 00 00 00 00 00 30d+16:51:15.413  SET FEATURES [Enable write cache]
  ef 00 aa 00 00 00 00 00 00 00 00 00 00 30d+16:51:15.412  SET FEATURES [Enable read look-ahead]
  ef 00 03 00 46 00 00 00 00 00 00 00 00 30d+16:51:15.412  SET FEATURES [Set transfer mode]

Error 51 [50] occurred at disk power-on lifetime: 11885 hours (495 days + 5 hours)
  When the command that caused the error occurred, the device was active or idle.

  After command completion occurred, registers were:
  ER -- ST COUNT  LBA_48  LH LM LL DV DC
  -- -- -- == -- == == == -- -- -- -- --
  c0 -- 01 00 01 00 00 00 c2 4f e0 00 00  Error: 

  Commands leading to the command that caused the error were:
  CR FEATR COUNT  LBA_48  LH LM LL DV DC  Powered_Up_Time  Command/Feature_Name
  -- == -- == -- == == == -- -- -- -- --  ---------------  --------------------
  b0 00 d6 00 01 00 00 00 c2 4f e0 00 00 30d+16:51:14.412  SMART WRITE LOG
  ef 00 66 00 00 00 00 00 00 00 00 00 00 30d+16:51:14.166  SET FEATURES [Disable revert defaults]
  ef 00 02 00 00 00 00 00 00 00 00 00 00 30d+16:51:14.166  SET FEATURES [Enable write cache]
  ef 00 aa 00 00 00 00 00 00 00 00 00 00 30d+16:51:14.166  SET FEATURES [Enable read look-ahead]
  ef 00 03 00 46 00 00 00 00 00 00 00 00 30d+16:51:14.165  SET FEATURES [Set transfer mode]

Error 50 [49] occurred at disk power-on lifetime: 11885 hours (495 days + 5 hours)
  When the command that caused the error occurred, the device was active or idle.

  After command completion occurred, registers were:
  ER -- ST COUNT  LBA_48  LH LM LL DV DC
  -- -- -- == -- == == == -- -- -- -- --
  c0 -- 01 00 01 00 00 00 c2 4f e0 00 00  Error: 

  Commands leading to the command that caused the error were:
  CR FEATR COUNT  LBA_48  LH LM LL DV DC  Powered_Up_Time  Command/Feature_Name
  -- == -- == -- == == == -- -- -- -- --  ---------------  --------------------
  b0 00 d6 00 01 00 00 00 c2 4f e0 00 00 30d+16:51:13.165  SMART WRITE LOG
  ef 00 66 00 00 00 00 00 00 00 00 00 00 30d+16:51:12.919  SET FEATURES [Disable revert defaults]
  ef 00 02 00 00 00 00 00 00 00 00 00 00 30d+16:51:12.919  SET FEATURES [Enable write cache]
  ef 00 aa 00 00 00 00 00 00 00 00 00 00 30d+16:51:12.919  SET FEATURES [Enable read look-ahead]
  ef 00 03 00 46 00 00 00 00 00 00 00 00 30d+16:51:12.919  SET FEATURES [Set transfer mode]

Error 49 [48] occurred at disk power-on lifetime: 11885 hours (495 days + 5 hours)
  When the command that caused the error occurred, the device was active or idle.

  After command completion occurred, registers were:
  ER -- ST COUNT  LBA_48  LH LM LL DV DC
  -- -- -- == -- == == == -- -- -- -- --
  c0 -- 01 00 01 00 00 00 c2 4f e0 00 00  Error: 

  Commands leading to the command that caused the error were:
  CR FEATR COUNT  LBA_48  LH LM LL DV DC  Powered_Up_Time  Command/Feature_Name
  -- == -- == -- == == == -- -- -- -- --  ---------------  --------------------
  b0 00 d6 00 01 00 00 00 c2 4f e0 00 00 30d+16:51:11.918  SMART WRITE LOG
  ef 00 66 00 00 00 00 00 00 00 00 00 00 30d+16:51:11.672  SET FEATURES [Disable revert defaults]
  ef 00 02 00 00 00 00 00 00 00 00 00 00 30d+16:51:11.672  SET FEATURES [Enable write cache]
  ef 00 aa 00 00 00 00 00 00 00 00 00 00 30d+16:51:11.672  SET FEATURES [Enable read look-ahead]
  ef 00 03 00 46 00 00 00 00 00 00 00 00 30d+16:51:11.672  SET FEATURES [Set transfer mode]

Warning! SMART Extended Comprehensive Error Log Structure error: invalid SMART checksum.
Error 48 [47] occurred at disk power-on lifetime: 11885 hours (495 days + 5 hours)
  When the command that caused the error occurred, the device was active or idle.

  After command completion occurred, registers were:
  ER -- ST COUNT  LBA_48  LH LM LL DV DC
  -- -- -- == -- == == == -- -- -- -- --
  c0 -- 01 00 01 00 00 00 c2 4f e0 00 00  Error: 

  Commands leading to the command that caused the error were:
  CR FEATR COUNT  LBA_48  LH LM LL DV DC  Powered_Up_Time  Command/Feature_Name
  -- == -- == -- == == == -- -- -- -- --  ---------------  --------------------
  b0 00 d6 00 01 00 00 00 c2 4f e0 00 00 30d+16:51:10.671  SMART WRITE LOG
  ef 00 66 00 00 00 00 00 00 00 00 00 00 30d+16:51:10.425  SET FEATURES [Disable revert defaults]
  ef 00 02 00 00 00 00 00 00 00 00 00 00 30d+16:51:10.425  SET FEATURES [Enable write cache]
  ef 00 aa 00 00 00 00 00 00 00 00 00 00 30d+16:51:10.425  SET FEATURES [Enable read look-ahead]
  ef 00 03 00 46 00 00 00 00 00 00 00 00 30d+16:51:10.425  SET FEATURES [Set transfer mode]

SMART Extended Self-test Log Version: 1 (2 sectors)
No self-tests have been logged.  [To run self-tests, use: smartctl -t]

SMART Selective self-test log data structure revision number 1
 SPAN  MIN_LBA  MAX_LBA  CURRENT_TEST_STATUS
    1        0        0  Not_testing
    2        0        0  Not_testing
    3        0        0  Not_testing
    4        0        0  Not_testing
    5        0        0  Not_testing
Selective self-test flags (0x0):
  After scanning selected spans, do NOT read-scan remainder of disk.
If Selective self-test is pending on power-up, resume after 0 minute delay.

SCT Status Version:                  3
SCT Version (vendor specific):       1 (0x0001)
SCT Support Level:                   0
Device State:                        Active (0)
Current Temperature:                    27 Celsius
Power Cycle Min/Max Temperature:     25/30 Celsius
Lifetime    Min/Max Temperature:     13/45 Celsius
Under/Over Temperature Limit Count:   0/0
Vendor specific:
00 00 63 00 00 00 00 00 00 00 00 00 00 00 00 00
00 00 00 00 00 00 00 00 00 00 00 00 00 00 00 00

Write SCT Data Table failed: megasas_cmd result: 2.0 = 0/46
Read SCT Temperature History failed

Write SCT (Get) Error Recovery Control Command failed: ATA return descriptor not supported by controller firmware
SCT (Get) Error Recovery Control command failed

Device Statistics (GP Log 0x04)
Page  Offset Size        Value Flags Description
0x01  =====  =               =  ===  == General Statistics (rev 2) ==
0x01  0x008  4              35  ---  Lifetime Power-On Resets
0x01  0x018  6    125577993187  ---  Logical Sectors Written
0x01  0x020  6        14282357  ---  Number of Write Commands
0x01  0x028  6     11945197120  ---  Logical Sectors Read
0x01  0x030  6        19061946  ---  Number of Read Commands
0x04  =====  =               =  ===  == General Errors Statistics (rev 1) ==
0x04  0x008  4               0  ---  Number of Reported Uncorrectable Errors
0x04  0x010  4               2  ---  Resets Between Cmd Acceptance and Completion
0x05  =====  =               =  ===  == Temperature Statistics (rev 1) ==
0x05  0x008  1              27  ---  Current Temperature
0x05  0x010  1              26  ---  Average Short Term Temperature
0x05  0x018  1              26  ---  Average Long Term Temperature
0x05  0x020  1              43  ---  Highest Temperature
0x05  0x028  1              18  ---  Lowest Temperature
0x05  0x030  1              33  ---  Highest Average Short Term Temperature
0x05  0x038  1              20  ---  Lowest Average Short Term Temperature
0x05  0x040  1              26  ---  Highest Average Long Term Temperature
0x05  0x048  1              22  ---  Lowest Average Long Term Temperature
0x05  0x050  4               0  ---  Time in Over-Temperature
0x05  0x058  1              70  ---  Specified Maximum Operating Temperature
0x05  0x060  4               0  ---  Time in Under-Temperature
0x05  0x068  1               0  ---  Specified Minimum Operating Temperature
0x06  =====  =               =  ===  == Transport Statistics (rev 1) ==
0x06  0x008  4             318  ---  Number of Hardware Resets
0x06  0x010  4             156  ---  Number of ASR Events
0x06  0x018  4               0  ---  Number of Interface CRC Errors
0x07  =====  =               =  ===  == Solid State Device Statistics (rev 1) ==
0x07  0x008  1              10  ---  Percentage Used Endurance Indicator
                                |||_ C monitored condition met
                                ||__ D supports DSN
                                |___ N normalized value

SATA Phy Event Counters (GP Log 0x11)
ID      Size     Value  Description
0x0001  4            0  Command failed due to ICRC error
0x0003  4            0  R_ERR response for device-to-host data FIS
0x0004  4            0  R_ERR response for host-to-device data FIS
0x0006  4            0  R_ERR response for device-to-host non-data FIS
0x000a  4          111  Device-to-host register FISes sent due to a COMRESET
0x000b  4            0  CRC errors within host-to-device FIS
0x000d  4            0  Non-CRC errors within host-to-device FIS

$~~@#!#@~~$
{

		"fields": {
				"host_domain_id":    "NOTNULL",
				"cluster_domain_id": "NOTNULL",
				"5_raw":             "int64(0)",
				"9_raw":             "int64(11885)",
				"12_raw":            "int64(35)",
				"170_raw":           "int64(0)",
				"171_raw":           "int64(0)",
				"172_raw":           "int64(0)",
				"174_raw":           "int64(33)",
				"175_raw":           "int64(638)",
				"183_raw":           "int64(0)",
				"184_raw":           "int64(0)",
				"187_raw":           "int64(0)",
				"190_raw":           "int64(27)",
				"192_raw":           "int64(33)",
				"194_raw":           "int64(27)",
				"197_raw":           "int64(0)",
				"199_raw":           "int64(0)",
				"225_raw":           "int64(1916168)",
				"226_raw":           "int64(512)",
				"227_raw":           "int64(7)",
				"228_raw":           "int64(330537)",
				"232_raw":           "int64(0)",
				"233_raw":           "int64(0)",
				"234_raw":           "int64(0)",
				"241_raw":           "int64(1916168)",
				"242_raw":           "int64(182269)",
				"CurrentDriveTemperature_raw":"int64(27)"
		},

		"tags": {
				"disk_name":   "MegaraidDisk-0",
				"primary_key": "NOTNULL",
				"disk_domain_id":    "55cd2e404b7ee0e9",
				"disk_wwn":    "55cd2e404b7ee0e9"
		}
}
