{
{
}
}
$~~@#!#@~~$
/dev/sda -d sat # /dev/sda [SAT], ATA device
$~~@#!#@~~$
smartctl 6.5 2016-01-24 r4214 [x86_64-linux-4.10.0-42-generic] (local build)
Copyright (C) 2002-16, Bruce Allen, Christian Franke, www.smartmontools.org

=== START OF INFORMATION SECTION ===
Model Family:     Western Digital Blue Mobile
Device Model:     WDC WD10JPCX-24UE4T0
Serial Number:    WD-WXL1A96K9KA7
LU WWN Device Id: 5 0014ee 60711e39c
Firmware Version: 01.01A01
User Capacity:    1,000,204,886,016 bytes [1.00 TB]
Sector Sizes:     512 bytes logical, 4096 bytes physical
Rotation Rate:    5400 rpm
Device is:        In smartctl database [for details use: -P show]
ATA Version is:   ACS-2 (minor revision not indicated)
SATA Version is:  SATA 3.0, 6.0 Gb/s (current: 6.0 Gb/s)
Local Time is:    Wed Jan 10 18:04:50 2018 CST
SMART support is: Available - device has SMART capability.
SMART support is: Enabled
AAM feature is:   Unavailable
APM level is:     254 (maximum performance)
Rd look-ahead is: Enabled
Write cache is:   Enabled
ATA Security is:  Disabled, frozen [SEC2]
Wt Cache Reorder: Enabled

=== START OF READ SMART DATA SECTION ===
SMART overall-health self-assessment test result: PASSED

General SMART Values:
Offline data collection status:  (0x00)	Offline data collection activity
					was never started.
					Auto Offline Data Collection: Disabled.
Self-test execution status:      (   0)	The previous self-test routine completed
					without error or no self-test has ever 
					been run.
Total time to complete Offline 
data collection: 		(17160) seconds.
Offline data collection
capabilities: 			 (0x7b) SMART execute Offline immediate.
					Auto Offline data collection on/off support.
					Suspend Offline collection upon new
					command.
					Offline surface scan supported.
					Self-test supported.
					Conveyance Self-test supported.
					Selective Self-test supported.
SMART capabilities:            (0x0003)	Saves SMART data before entering
					power-saving mode.
					Supports SMART auto save timer.
Error logging capability:        (0x01)	Error logging supported.
					General Purpose Logging supported.
Short self-test routine 
recommended polling time: 	 (   2) minutes.
Extended self-test routine
recommended polling time: 	 ( 192) minutes.
Conveyance self-test routine
recommended polling time: 	 (   5) minutes.
SCT capabilities: 	       (0x7035)	SCT Status supported.
					SCT Feature Control supported.
					SCT Data Table supported.

SMART Attributes Data Structure revision number: 16
Vendor Specific SMART Attributes with Thresholds:
ID# ATTRIBUTE_NAME          FLAG     VALUE WORST THRESH TYPE      UPDATED  WHEN_FAILED RAW_VALUE
  1 Raw_Read_Error_Rate     0x002f   200   200   051    Pre-fail  Always       -       0
  3 Spin_Up_Time            0x0027   177   177   021    Pre-fail  Always       -       2125
  4 Start_Stop_Count        0x0032   100   100   000    Old_age   Always       -       514
  5 Reallocated_Sector_Ct   0x0033   200   200   140    Pre-fail  Always       -       0
  7 Seek_Error_Rate         0x002f   200   200   051    Pre-fail  Always       -       0
  9 Power_On_Hours          0x0032   100   100   000    Old_age   Always       -       528
 10 Spin_Retry_Count        0x0032   100   100   000    Old_age   Always       -       0
 11 Calibration_Retry_Count 0x0032   100   100   000    Old_age   Always       -       0
 12 Power_Cycle_Count       0x0032   100   100   000    Old_age   Always       -       133
192 Power-Off_Retract_Count 0x0032   200   200   000    Old_age   Always       -       8
193 Load_Cycle_Count        0x0032   200   200   000    Old_age   Always       -       1682
194 Temperature_Celsius     0x0022   109   102   000    Old_age   Always       -       38
196 Reallocated_Event_Count 0x0032   200   200   000    Old_age   Always       -       0
197 Current_Pending_Sector  0x0032   200   200   000    Old_age   Always       -       0
198 Offline_Uncorrectable   0x0030   100   253   000    Old_age   Offline      -       0
199 UDMA_CRC_Error_Count    0x0032   200   200   000    Old_age   Always       -       0
200 Multi_Zone_Error_Rate   0x0008   100   253   000    Old_age   Offline      -       0
240 Head_Flying_Hours       0x0032   100   100   000    Old_age   Always       -       521

General Purpose Log Directory Version 1
SMART           Log Directory Version 1 [multi-sector log support]
Address    Access  R/W   Size  Description
0x00       GPL,SL  R/O      1  Log Directory
0x01           SL  R/O      1  Summary SMART error log
0x02           SL  R/O      5  Comprehensive SMART error log
0x03       GPL     R/O      6  Ext. Comprehensive SMART error log
0x06           SL  R/O      1  SMART self-test log
0x07       GPL     R/O      1  Extended self-test log
0x09           SL  R/W      1  Selective self-test log
0x10       GPL     R/O      1  SATA NCQ Queued Error log
0x11       GPL     R/O      1  SATA Phy Event Counters log
0x80-0x9f  GPL,SL  R/W     16  Host vendor specific log
0xa0-0xa7  GPL,SL  VS      16  Device vendor specific log
0xa8-0xb6  GPL,SL  VS       1  Device vendor specific log
0xb7       GPL,SL  VS      38  Device vendor specific log
0xbd       GPL,SL  VS       1  Device vendor specific log
0xc0       GPL,SL  VS       1  Device vendor specific log
0xc1       GPL     VS      93  Device vendor specific log
0xe0       GPL,SL  R/W      1  SCT Command/Status
0xe1       GPL,SL  R/W      1  SCT Data Transfer

SMART Extended Comprehensive Error Log Version: 1 (6 sectors)
Device Error Count: 11
	CR     = Command Register
	FEATR  = Features Register
	COUNT  = Count (was: Sector Count) Register
	LBA_48 = Upper bytes of LBA High/Mid/Low Registers ]  ATA-8
	LH     = LBA High (was: Cylinder High) Register    ]   LBA
	LM     = LBA Mid (was: Cylinder Low) Register      ] Register
	LL     = LBA Low (was: Sector Number) Register     ]
	DV     = Device (was: Device/Head) Register
	DC     = Device Control Register
	ER     = Error register
	ST     = Status register
Powered_Up_Time is measured from power on, and printed as
DDd+hh:mm:SS.sss where DD=days, hh=hours, mm=minutes,
SS=sec, and sss=millisec. It "wraps" after 49.710 days.

Error 11 [10] occurred at disk power-on lifetime: 304 hours (12 days + 16 hours)
  When the command that caused the error occurred, the device was active or idle.

  After command completion occurred, registers were:
  ER -- ST COUNT  LBA_48  LH LM LL DV DC
  -- -- -- == -- == == == -- -- -- -- --
  04 -- 51 00 01 00 00 00 00 00 00 00 00  Error: ABRT

  Commands leading to the command that caused the error were:
  CR FEATR COUNT  LBA_48  LH LM LL DV DC  Powered_Up_Time  Command/Feature_Name
  -- == -- == -- == == == -- -- -- -- --  ---------------  --------------------
  b0 00 d5 00 01 00 00 00 c2 4f e1 00 08     09:20:56.913  SMART READ LOG
  b0 00 d5 00 01 00 00 00 c2 4f e1 00 08     09:20:56.913  SMART READ LOG
  b0 00 d5 00 01 00 00 00 c2 4f e0 00 08     09:20:56.913  SMART READ LOG
  b0 00 d6 00 01 00 00 00 c2 4f e0 00 08     09:20:56.912  SMART WRITE LOG
  b0 00 d6 00 01 00 00 00 c2 4f e0 00 08     09:20:56.912  SMART WRITE LOG

Error 10 [9] occurred at disk power-on lifetime: 303 hours (12 days + 15 hours)
  When the command that caused the error occurred, the device was active or idle.

  After command completion occurred, registers were:
  ER -- ST COUNT  LBA_48  LH LM LL DV DC
  -- -- -- == -- == == == -- -- -- -- --
  04 -- 51 00 01 00 00 00 00 00 00 00 00  Error: ABRT

  Commands leading to the command that caused the error were:
  CR FEATR COUNT  LBA_48  LH LM LL DV DC  Powered_Up_Time  Command/Feature_Name
  -- == -- == -- == == == -- -- -- -- --  ---------------  --------------------
  b0 00 d5 00 01 00 00 00 c2 4f e1 00 08     08:50:57.360  SMART READ LOG
  b0 00 d5 00 01 00 00 00 c2 4f e1 00 08     08:50:57.360  SMART READ LOG
  b0 00 d6 00 01 00 00 00 c2 4f e0 00 08     08:50:57.360  SMART WRITE LOG
  b0 00 d6 00 01 00 00 00 c2 4f e0 00 08     08:50:57.359  SMART WRITE LOG
  b0 00 d5 00 01 00 00 00 c2 4f e0 00 08     08:50:57.359  SMART READ LOG

Error 9 [8] occurred at disk power-on lifetime: 303 hours (12 days + 15 hours)
  When the command that caused the error occurred, the device was active or idle.

  After command completion occurred, registers were:
  ER -- ST COUNT  LBA_48  LH LM LL DV DC
  -- -- -- == -- == == == -- -- -- -- --
  04 -- 51 00 01 00 00 00 00 00 00 00 00  Error: ABRT

  Commands leading to the command that caused the error were:
  CR FEATR COUNT  LBA_48  LH LM LL DV DC  Powered_Up_Time  Command/Feature_Name
  -- == -- == -- == == == -- -- -- -- --  ---------------  --------------------
  b0 00 d5 00 01 00 00 00 c2 4f e1 00 08     08:40:57.114  SMART READ LOG
  b0 00 d5 00 01 00 00 00 c2 4f e0 00 08     08:40:57.114  SMART READ LOG
  b0 00 d6 00 01 00 00 00 c2 4f e0 00 08     08:40:57.114  SMART WRITE LOG
  b0 00 d6 00 01 00 00 00 c2 4f e0 00 08     08:40:57.113  SMART WRITE LOG
  b0 00 d5 00 01 00 00 00 c2 4f e0 00 08     08:40:57.113  SMART READ LOG

Error 8 [7] occurred at disk power-on lifetime: 303 hours (12 days + 15 hours)
  When the command that caused the error occurred, the device was active or idle.

  After command completion occurred, registers were:
  ER -- ST COUNT  LBA_48  LH LM LL DV DC
  -- -- -- == -- == == == -- -- -- -- --
  04 -- 51 00 01 00 00 00 00 00 00 00 00  Error: ABRT

  Commands leading to the command that caused the error were:
  CR FEATR COUNT  LBA_48  LH LM LL DV DC  Powered_Up_Time  Command/Feature_Name
  -- == -- == -- == == == -- -- -- -- --  ---------------  --------------------
  b0 00 d5 00 01 00 00 00 c2 4f e1 00 08     08:20:57.692  SMART READ LOG
  b0 00 d5 00 01 00 00 00 c2 4f e1 00 08     08:20:57.692  SMART READ LOG
  b0 00 d6 00 01 00 00 00 c2 4f e0 00 08     08:20:57.691  SMART WRITE LOG
  b0 00 d6 00 01 00 00 00 c2 4f e0 00 08     08:20:57.691  SMART WRITE LOG
  b0 00 d5 00 01 00 00 00 c2 4f e0 00 08     08:20:57.691  SMART READ LOG

Error 7 [6] occurred at disk power-on lifetime: 302 hours (12 days + 14 hours)
  When the command that caused the error occurred, the device was active or idle.

  After command completion occurred, registers were:
  ER -- ST COUNT  LBA_48  LH LM LL DV DC
  -- -- -- == -- == == == -- -- -- -- --
  04 -- 51 00 01 00 00 00 00 00 00 00 00  Error: ABRT

  Commands leading to the command that caused the error were:
  CR FEATR COUNT  LBA_48  LH LM LL DV DC  Powered_Up_Time  Command/Feature_Name
  -- == -- == -- == == == -- -- -- -- --  ---------------  --------------------
  b0 00 d5 00 01 00 00 00 c2 4f e1 00 08     07:50:58.033  SMART READ LOG
  b0 00 d5 00 01 00 00 00 c2 4f e1 00 08     07:50:58.033  SMART READ LOG
  b0 00 d6 00 01 00 00 00 c2 4f e0 00 08     07:50:58.032  SMART WRITE LOG
  b0 00 d6 00 01 00 00 00 c2 4f e0 00 08     07:50:58.032  SMART WRITE LOG
  b0 00 d5 00 01 00 00 00 c2 4f e0 00 08     07:50:58.032  SMART READ LOG

Error 6 [5] occurred at disk power-on lifetime: 301 hours (12 days + 13 hours)
  When the command that caused the error occurred, the device was active or idle.

  After command completion occurred, registers were:
  ER -- ST COUNT  LBA_48  LH LM LL DV DC
  -- -- -- == -- == == == -- -- -- -- --
  04 -- 51 00 01 00 00 00 00 00 00 00 00  Error: ABRT

  Commands leading to the command that caused the error were:
  CR FEATR COUNT  LBA_48  LH LM LL DV DC  Powered_Up_Time  Command/Feature_Name
  -- == -- == -- == == == -- -- -- -- --  ---------------  --------------------
  b0 00 d5 00 01 00 00 00 c2 4f e1 00 08     07:00:58.351  SMART READ LOG
  b0 00 d5 00 01 00 00 00 c2 4f e1 00 08     07:00:58.351  SMART READ LOG
  b0 00 d6 00 01 00 00 00 c2 4f e0 00 08     07:00:58.351  SMART WRITE LOG
  b0 00 d6 00 01 00 00 00 c2 4f e0 00 08     07:00:58.350  SMART WRITE LOG
  b0 00 d5 00 01 00 00 00 c2 4f e0 00 08     07:00:58.350  SMART READ LOG

Error 5 [4] occurred at disk power-on lifetime: 301 hours (12 days + 13 hours)
  When the command that caused the error occurred, the device was active or idle.

  After command completion occurred, registers were:
  ER -- ST COUNT  LBA_48  LH LM LL DV DC
  -- -- -- == -- == == == -- -- -- -- --
  04 -- 51 00 01 00 00 00 00 00 00 00 00  Error: ABRT

  Commands leading to the command that caused the error were:
  CR FEATR COUNT  LBA_48  LH LM LL DV DC  Powered_Up_Time  Command/Feature_Name
  -- == -- == -- == == == -- -- -- -- --  ---------------  --------------------
  b0 00 d5 00 01 00 00 00 c2 4f e1 00 08     06:40:58.595  SMART READ LOG
  61 00 08 00 38 00 00 39 97 73 f0 40 08     06:40:58.595  WRITE FPDMA QUEUED
  ea 00 00 00 00 00 00 00 00 00 00 e0 08     06:40:58.579  FLUSH CACHE EXT
  b0 00 d5 00 01 00 00 00 c2 4f e1 00 08     06:40:58.579  SMART READ LOG
  b0 00 d6 00 01 00 00 00 c2 4f e0 00 08     06:40:58.578  SMART WRITE LOG

Error 4 [3] occurred at disk power-on lifetime: 300 hours (12 days + 12 hours)
  When the command that caused the error occurred, the device was active or idle.

  After command completion occurred, registers were:
  ER -- ST COUNT  LBA_48  LH LM LL DV DC
  -- -- -- == -- == == == -- -- -- -- --
  04 -- 51 00 01 00 00 00 00 00 00 00 00  Error: ABRT

  Commands leading to the command that caused the error were:
  CR FEATR COUNT  LBA_48  LH LM LL DV DC  Powered_Up_Time  Command/Feature_Name
  -- == -- == -- == == == -- -- -- -- --  ---------------  --------------------
  b0 00 d5 00 01 00 00 00 c2 4f e1 00 08     05:50:58.747  SMART READ LOG
  b0 00 d5 00 01 00 00 00 c2 4f 09 00 08     05:50:58.747  SMART READ LOG
  b0 00 d5 00 01 00 00 00 c2 4f e1 00 08     05:50:58.746  SMART READ LOG
  b0 00 d6 00 01 00 00 00 c2 4f e0 00 08     05:50:58.746  SMART WRITE LOG
  b0 00 d5 00 01 00 00 00 c2 4f 06 00 08     05:50:58.746  SMART READ LOG

SMART Extended Self-test Log Version: 1 (1 sectors)
No self-tests have been logged.  [To run self-tests, use: smartctl -t]

SMART Selective self-test log data structure revision number 1
 SPAN  MIN_LBA  MAX_LBA  CURRENT_TEST_STATUS
    1        0        0  Not_testing
    2        0        0  Not_testing
    3        0        0  Not_testing
    4        0        0  Not_testing
    5        0        0  Not_testing
Selective self-test flags (0x0):
  After scanning selected spans, do NOT read-scan remainder of disk.
If Selective self-test is pending on power-up, resume after 0 minute delay.

SCT Status Version:                  3
SCT Version (vendor specific):       258 (0x0102)
SCT Support Level:                   1
Device State:                        Active (0)
Current Temperature:                    38 Celsius
Power Cycle Min/Max Temperature:     20/38 Celsius
Lifetime    Min/Max Temperature:     20/46 Celsius
Lifetime    Average Temperature:        34 Celsius
Under/Over Temperature Limit Count:   0/0
Vendor specific:
01 00 00 00 00 00 00 00 00 00 00 00 00 00 00 00
00 00 00 00 00 00 00 00 00 00 00 00 00 00 00 00

SCT Temperature History Version:     2
Temperature Sampling Period:         1 minute
Temperature Logging Interval:        1 minute
Min/Max recommended Temperature:      0/60 Celsius
Min/Max Temperature Limit:           -41/85 Celsius
Temperature History Size (Index):    128 (19)

Index    Estimated Time   Temperature Celsius
  20    2018-01-10 15:57    38  *******************
 ...    ..(126 skipped).    ..  *******************
  19    2018-01-10 18:04    38  *******************

SCT Error Recovery Control command not supported

Device Statistics (GP/SMART Log 0x04) not supported

SATA Phy Event Counters (GP Log 0x11)
ID      Size     Value  Description
0x0001  2            0  Command failed due to ICRC error
0x0002  2            0  R_ERR response for data FIS
0x0003  2            0  R_ERR response for device-to-host data FIS
0x0004  2            0  R_ERR response for host-to-device data FIS
0x0005  2            0  R_ERR response for non-data FIS
0x0006  2            0  R_ERR response for device-to-host non-data FIS
0x0007  2            0  R_ERR response for host-to-device non-data FIS
0x0008  2            0  Device-to-host non-data FIS retries
0x0009  2            4  Transition from drive PhyRdy to drive PhyNRdy
0x000a  2            4  Device-to-host register FISes sent due to a COMRESET
0x000b  2            0  CRC errors within host-to-device FIS
0x000f  2            0  R_ERR response for host-to-device data FIS, CRC
0x0012  2            0  R_ERR response for host-to-device non-data FIS, CRC
0x8000  4        31995  Vendor specific

$~~@#!#@~~$
{

		"fields": {
				"host_domain_id":    "NOTNULL",
				"cluster_domain_id": "NOTNULL",
				"1_raw":             "int64(0)",
				"3_raw":             "int64(2125)",
				"4_raw":             "int64(514)",
				"5_raw":             "int64(0)",
				"7_raw":             "int64(0)",
				"9_raw":             "int64(528)",
				"10_raw":            "int64(0)",
				"11_raw":            "int64(0)",
				"12_raw":            "int64(133)",
				"192_raw":           "int64(8)",
				"193_raw":           "int64(1682)",
				"194_raw":           "int64(38)",
				"196_raw":           "int64(0)",
				"197_raw":           "int64(0)",
				"198_raw":           "int64(0)",
				"199_raw":           "int64(0)",
				"200_raw":           "int64(0)",
				"240_raw":           "int64(521)",
				"CurrentDriveTemperature_raw":"int64(38)"
		},

		"tags": {
				"disk_name":   "sda",
				"primary_key": "NOTNULL",
				"disk_domain_id":    "50014ee60711e39c",
				"disk_wwn":    "50014ee60711e39c"
		}
}
